{
  "$schema": "https://json-schema.org/draft/2020-12/schema",
  "title": "Cambio lógico de Mantto Gestor",
  "type": "object",
  "required": ["schema_version", "change_id", "company", "type", "layer", "status"],
  "if": { "properties": { "status": { "const": "published" } } },
  "then": {
    "required": ["title", "module", "version", "final_summary", "reason", "user_impact", "main_files", "finalized_at", "responsible", "validation", "references"],
    "properties": { "references": { "required": ["commit"] } }
  },
  "properties": {
    "schema_version": { "const": 1 },
    "change_id": { "type": "string", "pattern": "^MG-[A-Z0-9]+(?:-[A-Z0-9]+)*$" },
    "title": { "type": "string", "minLength": 1 },
    "module": { "type": "string", "minLength": 1 },
    "version": { "type": "string", "minLength": 1 },
    "company": { "enum": ["GENERAL", "UNITED", "CORELLIAN"] },
    "type": { "enum": ["feature", "correction", "security", "configuration", "data", "maintenance"] },
    "layer": { "type": "array", "minItems": 1, "uniqueItems": true, "items": { "enum": ["FRONTEND", "BACKEND", "DATABASE", "INTEGRATION"] } },
    "final_summary": { "type": "string", "minLength": 1 },
    "reason": { "type": "string", "minLength": 1 },
    "user_impact": { "type": "string", "minLength": 1 },
    "main_files": {
      "type": "array",
      "minItems": 1,
      "uniqueItems": true,
      "items": { "type": "string", "minLength": 1 }
    },
    "status": { "enum": ["draft", "published", "cancelled"] },
    "finalized_at": { "type": "string", "pattern": "^\\d{4}-\\d{2}-\\d{2}T\\d{2}:\\d{2}:\\d{2}(?:\\.\\d+)?(?:Z|[+-]\\d{2}:\\d{2})$" },
    "responsible": { "type": "string", "minLength": 1 },
    "validation": { "type": "string", "minLength": 1 },
    "references": {
      "type": "object",
      "properties": {
        "commit": { "type": "string", "pattern": "^[0-9a-fA-F]{40}$" },
        "issue": { "type": ["string", "null"] },
        "pull_request": { "type": ["string", "null"] }
      }
    }
  }
}
